Text,Type
สั่งเซต เด็กชายได้เซท เด็กผู้หญิงคะ,neg
มันไม่นุบนับอร่อยอย่างที่คิด,neg
ความคุ้มค่าแย่,neg
บางและเล็กไปหน่อย,neg
ไม่อร่อย ,neg
ไม่ค่อยหอมมมม,neg
ไม่ค่อยอร่อยเท่าไหร่,neg
ได้สินค้ามาไม่ตรงกับที่ต้องการ,neg
ทักแชท แม่ค้าไม่อ่านแชทเลย,neg
แต่การบริการไม่โอเครเลยค่ะ ,neg
ตัวเล็กกว่าขนาดไซด์,neg
ผ้าบาง,neg
การให้บริการจากร้านค้าแย่มาก,neg
แพ็คของไม่ละเอียด ,neg
ขอให้1 ดาวละกัน,neg
แล้วของขาดนี่ให้ชมหรอคะ,neg
สากๆยังไงไม่รู้คะ,neg
ไม่มีสำนึก ขอให้ขายของดีนะจ้ะ ,neg
การให้บริการไม่ประทับใจเลย ,neg
คงไม่อุดหนุนละค่ะ,neg
คิดเยอะๆคะ,neg
ขอเตือน  ,neg
คนแบบนี้ไม่ไหวจริงๆ,neg
ซื้อร้านอื่นเลยคะ ,neg
เลยทิ้งทั้งหมดที่ซื้อ,neg
เป้าขาด ,neg
ความคุ้มค่าแย่มาก ,neg
ความรวดเร็วในการจัดส่งแย่มาก,neg
สินค้าดูเก่าดีค่ะเนื้อผ้าบางเฉียบ,neg
ที่เพชรบุรีอร่อยกว่านี้นะ,neg
ลอกหมดเลยค่ะ,neg
ใส่ไม่ได้ผ้าไม่ดี ,neg
หวานเกิ๊น,neg
ไม่อร่อยค่ะ ,neg
ขนมเจาะหูยิ่งแย่ หวานมากและแข็ง,neg
เวลาลูกค้าไม่รับของอย่าว่าเค้าเลย,neg
เพราะแม่ค้าก้อมักง่าย ,neg
อยากส่งอะไรก้อส่งมา,neg
ทิ้งคะ,neg
แป้งไม่สุก ,neg
ไม่อร่อยเลย,neg
ขาดคะ ,neg
ผิดเบอร์ค่ะ,neg
ฝักนึงมีหนอนแทบทุกเม็ด ,neg
กินไม่ได้เลยค่ะ ,neg
ทิ้งหมดเลย,neg
เหม็นแป้งดิบมาก ,neg
ไม่มีกลิ่นชา,neg
ไม่มีกลิ่นหอมชาค่ะ ใส่เยอะก็ยังไม่หอม,neg
อบไม่ค่อยแห้งเท่าไหร่ค่ะ,neg
ออกจะแฉะแล้วก็ไม่ค่อยเป็นเม็ดค่ะ,neg
ใส่ได้วันเดียวขาด,neg
ถุงเท้าบางมากก นึกว่าจะหนา ,neg
เสียดายเงิน,neg
ส่งสินค้ามาผิดค่ะ,neg
แต่มันเสียความรู้สึก ,neg
แม่ค้าควรจะรับผิดชอบส่วนที่ไม่ครบ ,neg
เสียตรงหีบห่อค่ะ ,neg
ของมาถึงมีมดขึ้นด้วย ,neg
ถ้าถึงช้ากว่านี้มดคงยิ่งเยอะเลย,neg
ปลามีมดเดินอยู่ในถุงเกือบร้อยตัวได้    ,neg
เสียเงินเสียเวลา ,neg
ถ้างั้นร้านควรจะซีลให้แน่นหนากว่านี้รึเปล่า,neg
นี่ซีลถุงพลาสติกแค่ชั้นเดียวเองมดเลยเจาะทะลุง่ายๆ,neg
เอาเป็นว่ายังไงก็รับไม่ได้กับอาหารที่มาพร้อมมดแบบนี้นะคะ,neg
ไว้เป็นบทเรียนว่าไม่ควรสั่งอาหารส่งพัสดุมาแบบนี้อีก,neg
ถุงมีรอยปริ ,neg
เศษเล็กๆหกเลอะเทอะในกล่อง ,neg
เนื้อปลาแข็งไปหน่อย,neg
แอบมีกลิ่นเหม็นหืน ,neg
ปรับปรุงเรื่องกลิ่นหืนจะดีมากๆเลยค่ะ,neg
ทางร้านให้ทุเรียนกวนมาไม่ถึงที่แจ้งไว้,neg
แบบมีแค่3 แบบเองคะ  ไม่หลากหลายเลย,neg
ซื้อ1โหลก็จะได้แต่ลายซ้ำๆ,neg
Size ไม่มาตรฐาน,neg
ใส่แล้วตะเข็บขาด,neg
เคอร์รี่มาฝากสินค้าไว้แต่ไม่ค่อยโทรแจ้ง ,neg
บอกให้โทรถึงจะโทรแจ้ง ,neg
ถ้าไม่บอกให้โทรก็ไม่โทร,neg
ส่งมาผิดสี,neg
เนื้อผ้าค่อนข้างบาง ,neg
ผ้าลื่นๆ น่าจะไม่ค่อยซับเหงื่อ ,neg
สินค้ามีตำหนิ ,neg
ถุงเท้าจริงสั้นกว่ารูปตัวอย่างมาก,neg
สินค้าไม่ตรงกับที่สั่ง ,neg
ไม่มีรูปบอกสินค้าที่ชัดเจน ,neg
ส่งของช้า ,neg
เนื้อผ้าบางไม่หนาอย่างที่เคยซื้อจากที่อื่น,neg
อย่างน้อยคือควรมิดชิดหน่อยค่ะ ฝากไว้ปรับปรุงแก้ไขด้วยค่ะ,neg
บางตัวขอบยุ่ย ,neg
การจัดส่งช้าไปหน่อย,neg
สะตอรสชาติแปลกๆ ,neg
สะตอมีเสียหาย,neg
แล้วก็เจอหนอนเยอะไปหน่อย ,neg
ผิดหวังนิดหน่อย,neg
คุณภาพ​สินค้า​น้อยลง,neg
ไม่กรอบเท่าไหร่ มันเหนียวๆ,neg
รสสัมผัสและรสชาติไม่ได้เลย ,neg
ไม่ได้นิ่มแบบที่คิดค่ะ,neg
ขนมเหนียวไปหน่อย เคี้ยวยาก ,neg
แต่ละแผ่นมันหนาและทึบมาก ,neg
คุณภาพของสินค้าแย่ ,neg
หวานจัด แป้งสุกไม่ทั่วถึง ,neg
บางชิ้นเหมือนมีกลิ่นคาว,neg
กลิ่นคาวปลาจะมากหน่อย ,neg
แข็งมาก ,neg
เนื้อปลาแห้งเป็นผลึกน้ำตาล,neg
ถุงที่บรรจุพุทรามาขาด ,neg
คุณภาพการจัดส่งไม่ดีครับ เพราะขวดแตก,neg
อาจจะไม่ถูกปากเท่าไหร่ค่ะ,neg
รสชาดแปลกๆ ,neg
รสชาติหวานไปหน่อยและออกเลี่ยนๆนิดๆ,neg
ไม่ได้รับสินค้า,neg
ตัวเล็กกว่าในรูปเยอะเลยคะ,neg
เค็ม ไม่หอม,neg
เนื้อหยาบมาก,neg
กินแล้วอารมณ์ค้างมากๆ,neg
ไม่ใช่อย่างที่ฝัน ,neg
สรุปครั้งเดียวพอ ,neg
เก็บไว้สามวันก้มีราขึ้นแล้ว,neg
ความคุ้มค่าแย่ ,neg
ไม่อร่อยเหมือนที่เคยกิน ,neg
แข็ง หยาบ ไม่นิ่ม,neg
กินแล้วสากๆ,neg
ขนมเจาะหูไม่ถูกปากเลย,neg
โดยส่วนตัวไม่ค่อยถูกปากค่,neg
ปลาสวรรค์เที่ยวนี้ยังไม่ถูกใจ,neg
เหมือนของค้างนาน ,neg
รถชาติไม่โอเลย ,neg
เหมือนเก็บไว้นาน,neg
ทำไมไม่ดูให้ดีก่อนหยิบให้ลูกค้า,neg
กลิ่นแปลกๆ ,neg
ทานไปนิดเดียวเลยทิ้งค่ะ ,neg
ดูแล้วน่าจะย้วยง่าย,neg
ผ้าบางจนตรงสีดำเห็นสีขาวแซมอยู่ ,neg
ส่วนตัวไม่ค่อยชอบ ,neg
ควรมีการตรวจเช็คให้ดีก่อนส่งครับ ,neg
สั่งสีขาวพื้นเทาแต่ได้ขาวล้วน,neg
ส่งมาผิดสี,neg
บางฝักไม่มีกลิ่น ,neg
บางฝักเหมือนสะตอดานแต่กลิ่นไม่ใช่,neg
สะตอขึ้นรา,neg
ถ้าไม่มีสีที่ต้องการควรแจ้งลูกค้า,neg
ไม่ใช่ให้ตีคืน ส่งไปส่งมา,neg
ต้องแก้ตั้งแต่ต้นทางค่ะ,neg
ไม่เหมือนในภาพ,neg
มันจะร่วนๆแข็งๆ น้ำมันเยอะมากเลยค่ะ  ,neg
อย่าใช้อารมณ์ ใช้สมองคะ,neg
กลิ่นถั่วไม่เด่นค่ะ,neg
แต่ส่วนตัวว่ามันไม่หอมถั่ว  ,neg
ใส่ได้ไม่พอดี ,neg
เหนียวติดมือ ,neg
ปลาหมึกร้านนี้เหมือนจะไม่สะอาด ,neg
แม้ค้าส่งของได้ไม่ตามนัด,neg
