Text,Type
ไม่อร่อย เฉยๆ ,neg
ไม่อร่อย แป้งเยอะ และมันด้วย,neg
ไม่อร่อย และก็เผ็ดปานกลาง ,neg
ไม่อร่อย ไม่มีกลิ่นของเนื้อปลาเลย ,neg
ไม่อร่อย มีกลิ่นแปลกๆ,pos
ไม่อร่อยเท่าที่เคยกิน ,neg
ไม่อร่อยเลย,neg
ไม่อร่อยเลยอะ,neg
ไม่อร่อยเหมือนที่เคยกิน ,neg
ไม่อร่อยค่ะ ,neg
ไม่อายที่เอาสินค้ากระจอกแบบนี้มาขาย ถือว่าหลอกลวง ,neg
ไว้เป็นบทเรียนว่าไม่ควรสั่งอาหารส่งพัสดุมาแบบนี้อีก,neg
ไว้งวดหน้าสั่งอีกค่ะ,pos
ไว้จะมาอุดหนุนใหม่นะคะ,pos
ไว้จะมาอุดหนุนใหม่นะคะ,pos
ไว้จะสั่งเพิ่มอีกนะคะ,pos
ไว้จะสั่งเพิ่มอีกนะคะ ,pos
ไว้จะสั่งซื้ออีกนะคะ ,pos
ไว้จะอุดหนุนอีกแน่นอนค่ะขอบคุณมากค่ะ ,pos
ไว้จะอุดหนุนอีกนะคะ,pos
ไว้วันนหลังจะอุดหนุนใหม่นะคะ ซื้อฝากแม่ แม่ชอบเลย,pos
ไว้สั่งอีกค่ะ ขอบคุณค่ะ,pos
ไว้อุดหนุนใหม่จ้าาาาาาา,pos
ไส้เค็มหวานกลมกล่อมดีค่ะ,pos
ไส้แน่นเต็มคำเป็นของฝากได้ถูกใจ,pos
"ไส้คือ ""กระจิ๊ด"" มาก คือแทบจะไม่มีเลย ควรปรับปรุงตรงนี้นะครับ",neg
ไส้น้อยมาก,neg
ก็โอเคอยู่ค่ะ ,pos
ก้นถุงรั่วค่ะ ,neg
กรอบ เผ็ดกำลังดี ดูใหม่และสะอาด,pos
กรอบ อร่อยมากค่ะ,pos
กรอบดี ไม่เผ็ดไม่มันเกินไป ไม่เหม็นหืน​,pos
กรอบรสชาติอร่อย,pos
กรอบอร่อยดี ไม่เผ็ดมาก ของใหม่,pos
กระป๋องบิดเบี้ยวมาเชียว,neg
กระป๋องบุบหน่อยๆ,neg
กระปุกแฟ๊บบุบเป็นจำนวนมาก น่าจะมากกว่าครึ่ง,neg
กระปุกบุบบี้มาทั้ง2กระปุกเลยค่ะ,neg
กระปุกบู้บี้มาก น้ำมันเยิ้มๆ,neg
กล่องแพ็คมาอย่างดีไม่มีรอยบุบหรือยุบเลย ส่งมาเร็วมากๆ ,pos
"กล่องแอบบู้บี้นิดหน่อย 

",neg
กล่องบุบไปนิด ,neg
กล่องบุบไม่ว่าแต่นี่มันเหม็นเหมือนมีขี้แมลงสาบปนอยู่อ่ะ,neg
กล่องบุบบี้มาก ,neg
กล่องพริกบุบไปหลายอันอยู่ ,neg
กล่องรู้สึกมันหน่อยๆ,neg
กลับมาสั่งอีกแน่นอน,pos
กลับมาสั่งอีกแน่นอนค่ะ ,pos
กลิ่นเครื่องปรุงแรงไป ,neg
กลิ่นเหม็นมาก ,neg
กลิ่นแปลกๆ ,neg
กลิ่นแรงไปหน่อย,neg
กลิ่นคาวปลาจะมากหน่อย ,neg
กลิ่นชาหอมมากก,pos
กลิ่นถั่วไม่เด่นค่ะ,neg
ก้อให้ 5 ดาวไปเลยค่ะ,pos
การแพ็คสินค้าถือว่าดีค่ะ ,pos
การให้บริการไม่ประทับใจเลย ,neg
การให้บริการจากขนส่งเคอรี่รวดเร็ว,pos
การให้บริการจากบริษัทขนส่งแย่ ,neg
การให้บริการจากบริษัทขนส่งดีมากค่าาาาา,pos
การให้บริการจากร้านค้าแย่มาก,neg
การให้บริการจากร้านค้าแย่มาก,neg
การให้บริการจากร้านค้าแย่มากๆ ,neg
การขนล่าช้ามากค่ะ ,neg
การจัดส่งช้าไปหน่อย,neg
การจัดส่งช้ากว่ากำหนด 3 วันค่ะ,neg
การจัดส่งที่รวดเร็ว​ ขอบคุณ​ครับ​,pos
การจัดส่งพัสดุเรียบร้อยดีเยี่ยม ,pos
การจัดส่งรวดเร็ว สินค้าที่ได้รับก็ตรงตามที่สั่งซื้อ ถูกใจมากเลยค่ะ,pos
การจัดส่งรวดเร็วมากมากครับ​ ,pos
การจัดส่งสินค้าจากทางร้านรวดเร็ว ,pos
การบริการของบริษัทชนส่งและพนักงานขนส่งบริการดีค่ะ,pos
กำลังแนะนำให้พี่สาวสั่งไปค่ะ,pos
กินเปล่าๆก็เพลิน ,pos
กินเพลิน ไม่หวานมาก  ,pos
กินเพลินครั้งเดียวหมดไปครึ่งถุง ,pos
กินเพลินมาก รสชาติดี  ,pos
กินเพลินๆจะหมดถุงแล้ว ,pos
กินแล้วไตวายแน่ๆๆๆ,neg
กินแล้วมีกลิ่นเหม็นหืนนิดหน่อยค่ะ,neg
กินแล้วสากๆ,neg
กินแล้วอร่อยดีค่ะได้กลิ่นยีสต์,pos
กินแล้วอารมณ์ค้างมากๆ,neg
กินได้ไม่เบื่อเลยค่ะ เพลินมากๆ รสชาติดี ,pos
กินไม่ได้เลยค่ะ ,neg
กินกับชา กาแฟกำลังดีเลย,pos
กินหมดแล้วจะสั่งเพิ่มนะคะ ,pos
กุ้ง รสชาติเค็ม,neg
กุ้งขนาดเล็ก ไม่เป็นไปตามรูปภาพ,neg
กุ้งตัวเล็กมากยังกะกุ้งฝอย  ,neg
กุ้งตัวเล็กมากๆๆๆๆๆๆ ไม่เห็นเหมือนในรูปเลย ,neg
กุ้งตัวไม่ใหญ่มาก สมราคาค่ะ ส่งเร็วดี,pos
กุ้งมีเปลือก และ ค่อนข้างเค็ม มีกลิ่น เนื้อไม่แน่นฝ่อๆ,neg
กุนเชียงอร่อยดีค่ะ ไม่มีกลิ่นเหม็นคาวปลา ,pos
ขนมเจาะหูไม่ถูกปากเลย,neg
ขนมเจาะหูยิ่งแย่ หวานมากและแข็ง,neg
ขนมเหนียวไปหน่อย เคี้ยวยาก ,neg
ขนมไม่เสียหาย ,pos
ขนมดู นุ่มนิ่มมีไส้มะพร้าว รสกลมกลอม อร่อยดี ชอบมากค่ะ ,pos
ขนมดูอร่อยค่ะแบบที่คิดไว้เลย,pos
ขนมตุ๊บตั๊บแพคมาดีค่ะ ,pos
ขนมนุ่มมากๆๆๆๆๆค่ะ,pos
ขนมปั้นสิบ แป้งบางกรอบหอมอร่อยดีค่ะ,pos
ขนมมีแตกเสียหายค่ะ,neg
ขนมรสชาติอร่อยทุกอย่างเลย,pos
ขนมรสชาติอร่อยทุกอย่างเลย ,pos
ขนมรสชาติอร่อยมากๆ ,pos
ขนมอร่อย แพ็คมาดี ,pos
ขนมอร่อยมาก สดใหม่ ,pos
ขนมอร่อยมากกกกกก ถูกใจมากก ,pos
ขนมอาจจะมาช้าไปหน่อย แต่รสชาติอร่อย   ,pos
ขนส่งเคอรี่บริการดีค่ะ,pos
ขนส่งดีค่ะ รวดเร็ว ,pos
ขนาดเล็กกว่าที่คิด ,neg
ขนาดไม่เท่ากันค่ะ,neg
ขนาดกับราคาเหมาะสมกันดี,pos
ขวดยุ่ย,neg
ขอเตือน  ,neg
ขอให้1 ดาวละกัน,neg
ของใหม่ สด รสชาติดี ,pos
ของใหม่ดีจร้าาาาา ชอบบๆๆๆๆๆๆๆจร้าาาาาาา,pos
ของไม่สด ไม่กรอบ  ,neg
ของก็ ok ครับ ผ้านุ่มดี ,pos
ของข้างในสภาพดีค่ะ อร่อยดี ,pos
ของดีจริงๆนะคะ ,neg
ของที่ได้คุ้มราคาดีมาก,pos
ของมาถึงมีมดขึ้นด้วย ,neg
ของส่งช้า สินค้าที่ได้รับบุบบี้,neg
ขอบคุณ​ร้านค้ามากมากครับ สำหรับขนมที่อร่อย,pos
ขาดคะ ,neg
ขายแบบนี้แย่นะคะ,neg
ขายของไม่ตรงกับแจ้งลูกค้าแบบนี้แย่ค่ะ ,neg
ข้าวซอยตัดอร่อยมากกก นุ่มลิ้นหวานมัน,pos
คงได้อุดหนุนบ่อยๆนะคะ,pos
คงไม่อุดหนุนละค่ะ,neg
คงไม่อุดหนุนอีกแน่นอน,neg
คนแบบนี้ไม่ไหวจริงๆ,neg
ครั้งนี้เป็นครั้งแรกที่ทาน อร่อยดีค่ะ หนึบ หอม ไม่หวานเกินด้วยค่ะ,pos
ครั้งนี้เม็ดเล็กกว่าครั้งที่แล้วมากเลย  แถมมีเปลือกติดมาเยอะด้วย,neg
คราวหน้าจะมาสั่งซื่ออีกคะ,pos
คราวหน้าจะลองสั่งรสชาติอื่นบ้าง,pos
ควรจะมีวันเดือนปีที่ผลิต และวันที่หมดอายุ ,neg
ควรต้องลงโทษทางกฎหมาย จะได้ไม่ต้องโกหกแบบนี้ไปเรื่อยๆ ,neg
ควรมีการตรวจเช็คให้ดีก่อนส่งครับ ,neg
ความคุ้มค่าแย่,neg
ความคุ้มค่าแย่,neg
ความคุ้มค่าแย่ ,neg
ความคุ้มค่าแย่มาก,neg
ความคุ้มค่าแย่มาก ,neg
ความคุ้มค่าดีได้ปริมาณเยอะในราคาแบบนี้ ,pos
ความรวดเร็วในการจัดส่งแย่มาก,neg
ความรวดเร็วในการจัดส่งแย่มาก ,neg
ความรวดเร็วในการจัดส่งช้ามาก,neg
"ความรวดเร็วในการจัดส่งดีมาก 


",pos
ความรวดเร็วในการจัดส่งสินค้าดีมาก ,pos
ความสะอาดคือบางเม็ดมีสีขาวและเศษๆเปลือกปนเยอะ,neg
ความหอมไม่มีเลย ฉุนมาก แต่แพ็คเกจสวย,neg
คอนเฟิร์มอีก1เสียง ว่าสินค้าดีมีคุณภาพจริงๆ,pos
"ค่อนข้าง ที่จะไม่ ok ในราคาสินค้า
",neg
คาดว่าจะได้ใช้บริการครั้งต่อๆไป,pos
ค่าส่งแพงว่ากว่าสินค้า  ,neg
คิดเยอะๆคะ,neg
คิดว่าเป็นกาละแม ผิดหวังค่ะ ,neg
คิดว่าไม่กรอบ,neg
คือช่วยตอบหน่อยได้ไหมค่ะ ว่าทำไมถึงส่งของหมดอายุมา ,neg
คือดีงามค่ะ,pos
คุณแม่ค้าน่ารักมากค่ะ พูดจาเพราะ สุภาพกับลูกค้ามากเลย,pos
คุณทำงานบริการไม่ควรทำกริยาแบบนี้ ,neg
คุณภาพ ดีกว่าที่คาด ค่ะ,pos
คุณภาพ​สินค้า​น้อยลง,neg
คุณภาพไม่เหมือนกินสมัยแต่ก่อน รสเฝื่อนนิดๆ,neg
คุณภาพการจัดส่งไม่ดีครับ เพราะขวดแตก,neg
คุณภาพของสินค้าแย่,neg
คุณภาพของสินค้าแย่ ,neg
คุณภาพของสินค้าแย่มาก ,neg
คุณภาพของสินค้าแย่มาก ,neg
คุณภาพของสินค้าไม่ค่อยดีค่ะ​ ,neg
คุณภาพของสินค้าดี  ความคุ้มค่าดี  ราคาไม่แพงเกินไปคุณภาพของสินค้าดี,pos
คุณภาพของสินค้าดีค่ะ ,pos
คุณภาพของสินค้าดีค่ะ ไม่บางมาก ,pos
คุณภาพของสินค้าดีมาก ความคุ้มค่าดีมาก ,pos
คุณภาพของสินค้าดีมากนะคะ สินค้าสดใหม่ไม่เหม็นหืนค่ะ ,pos
คุณภาพของสินค้าดีมากๆ มีของแถมให้ด้วย,pos
"คุณภาพของสินค้าดีๆๆๆๆๆๆๆๆๆๆๆๆๆๆๆๆ บริษัทขนส่งดีๆๆๆๆๆๆๆๆๆๆๆๆๆๆๆๆๆๆ
ใส่ได้พอดีๆๆๆๆๆๆๆๆๆๆๆๆๆๆๆๆๆ",pos
คุณภาพของสินค้าบางเกิน ,neg
คุณภาพถุงเท้าเกินราคามากค่าาา,pos
คุณภาพสินค้าดี กรอบมัน ไม่เหม็นหืน แม่ค้าตอบรวดเร็วคะ แนะนำ,pos
คุณภาพสินค้าดีนะคะ ราคาถูกกว่าร้านอื่นด้วย รสนี้อร่อยสุดค่ะ,pos
คุณภาพสินค้าดีมาก คุ้มค่าดีมาก จัดส่งของได้รวดเร็ว ,pos
คุณภาพสินค้าดีมาก ราคาถูก ,pos
คุณภาพสินค้าดีมากเทียบกับราคา 5 ดาวคงไม่พอ ,pos
คุณภาพสินค้ารอบนี้ ด้อยกว่าที่ผ่านมา,neg
คุ้มเกินราคา,pos
คุ้มค่ามากเลย,pos
คุ้มคุ้มค่า  ,pos
คุ้มจริงๆๆๆๆๆๆๆๆๆ ,pos
คุ้มมมมมมมมมมมมมมมมมมมค่ามากกกกกกกกกกกกกกกกกก,pos
คุ้มมากค่ะ,pos
คุ้มมากๆสินค้าดี,pos
งงมาก แถมไม่ตอบ ไม่มีความรับผิดชอบ แย่มาก ,neg
งานเรียบร้อยดีค่ะ,pos
จริงๆผิดหวังกับเปลือกถั่วไม่อ้าแกะยากมากๆมาหลายครั้ง​ควรปรับปรุงสักทีสิคะ,neg
จะกลับมาซื้ออีกแน่นอน,pos
จะกลับมาสั่งอีกแน่นอน ,pos
จะซื้อตามตลาดยังใส่ถุงดีก่านี้,neg
จะสั่งอีกแน่นอนค่ะอร่อยทุกอย่างค่ะ,pos
จะอุดหนุนอีกคะ ,pos
จัดส่งเร็วดีมากกกกก รอบนี้ราคาดีมากๆ ถูกใจค่ะ ,pos
จัดส่งได้รวดเร็วค่ะ คุณภาพของสินค้าถือว่าดี  โดยรวมดีค่ะ,pos
จัดส่งไว แพ็คมาดี สั่งรอบสอง ,pos
จัดส่งขนมอย่างรวดเร็ว  รสชาติขนมเหมือนกับขนมจาก ,pos
จัดส่งช้า ไม่ทันใจ​ ,neg
จัดส่งนับว่าเร็วประมาณ4-5วัน,pos
จัดส่งนานเกิ๊น,neg
จัดส่งรวดเร็ว ,pos
จัดส่งรวดเร็วดี ,pos
จัดส่งรวดเร็วดี การให้บริการจากร้านค้าดี ,pos
จัดส่งสินค้ารวดเร็ว​มาก​ทั้งจากร้านค้า​และKerry​ ,pos
จี๊ดจ้าด สะใจ ใส้ติ่งสะดุ้ง,pos
ชอบค่ะ รับปุ๊บกินไปครึ่งกระปุกละ,pos
ชอบตรงเป้า2ชั้น ยืดได้เยอะ ใส่ไม่อึดอัด ,pos
ชอบทานเล่น อร่อย เพลิน,pos
ชอบที่ดูสะอาด ถ้าหมดแล้วจะกลับมาซื้ออีกค่ะ,pos
ชอบมากกกกกกกครับ,pos
ชอบมากค่ะ ด้านบริการขนส่ง พนักงานสุภาพเรียบร้อย,pos
ชาเข้มดี สีก็เข้มด้วย ,pos
ชาไม่หอมเลย ,neg
ชาก็หอม ,pos
ชาหอม และรสชาติดีมากค่ะ คุ้มค่ามาก ,pos
ชาหอมจริงๆ ทำขายได้สบายเลย,pos
ชาหอมมากค่ะ,pos
ชาหอมอร่อยดี  ,pos
ชิ้นค่อนข้างเล็ก แตก เป็นผง,neg
ชิ้นพอเหมาะ คุ้มค่า คุ้มราคาจริงๆ,pos
ซื้อ1โหลก็จะได้แต่ลายซ้ำๆ,neg
ซื้อในช่วงจัดโปรได้ราคาพิเศษถูกมาก และใช้สิทธิ์ส่งฟรี ชอบสุดๆ,pos
ซื้อซ้ำแน่นอนเพราะถูกกว่าร้านอื่น ,pos
ซื้อตอนโปรโมชั่นด้วยคุ้มสุดๆ ,pos
ซื้อมาไม่ผิดหวัง ,pos
ซื้อร้านอื่นเลยคะ ,neg
ดำจนน่าตกใจค่ะ ,neg
"ดีค่ะ ผ้าดี 
",pos
ดีมากเลยคุ้มค่า,pos
ดูแลเข้าใจลูกค้า,pos
ดูแล้วน่าจะย้วยง่าย,neg
ดูใหม่ดี ไม่แตกหัก,pos
ดูใหม่อยู่,pos
ดูไม่ค่อยน่าทานเท่าไหร่ ,neg
ดูจากรีวิวแต่สิ่งที่ได้คือแย่,neg
ดูฉลากเก่า​ อยากให้เค็มน้อยกว่านี้,neg
ดูฉลากเก่า​ อยากให้เค็มน้อยกว่านี้,neg
ดูสะอาด ใหม่ดีมาก ,pos
ต้องแก้ตั้งแต่ต้นทางค่ะ,neg
ต้องพิจารณาตัวเองแล้วคะ,neg
ต้องสั่งมาเพิ่มแน่นอนคะ ,pos
ต้องสั่งอีกกกกกกกกแน่ๆๆๆๆๆๆๆๆนอนนนนนนนนนนนนน ,pos
ตะเข็บเย็บไม่ดี ,neg
ตัวเล็กกว่าในรูปเยอะเลยคะ,neg
ตัวเล็กกว่าขนาดไซด์,neg
ตัวขนมกรอบนอกนุ่มใน ,pos
ตัวขนมอร่อยใช้ได้เลยค่ะ,pos
ตำน้ำพริกอรอ่ยมากๆๆๆ,pos
ติดใจเดี๋ยวสั่งอีกแน่นอน,pos
ถั่วเก่าไปหน่อยครับ,neg
ถั่วไม่ค่อยกรอบเท่าไหร่แต่รวมก็ได้ค่ะ,neg
ถั่วมีกลิ่นอับมาก เม็ดเล็กมากๆด้วย,neg
ถั่วอร่อยมากคะ  ,pos
ถ้าไม่บอกให้โทรก็ไม่โทร,neg
ถ้าไม่มีสีที่ต้องการควรแจ้งลูกค้า,neg
ถ้าคนชอบทานเผ็ดน่าจะชอบมากๆ แต่โดยรวมแล้วถือว่าดีค่ะ,pos
ถ้าคิดจะเตือนแม่ค้าไม่ต้องเตือนคะ ,neg
ถ้าคุณยอมรับความคิดเห็นไม่ได้ยังสมควรขายสินค้าอยู่มั้ย,neg
ถ้างั้นร้านควรจะซีลให้แน่นหนากว่านี้รึเปล่า,neg
ถ้าถึงช้ากว่านี้มดคงยิ่งเยอะเลย,neg
ถามแชทไปทางร้านไม่ตอบเลยค่ะ ,neg
ถ้าหมดแล้วจะสั่งใหม่นะคะ ,pos
ถึงกับต้องกลับมาสั่งอีก  ,pos
ถือว่าเป็นการทานขนมดูครั้งแรกที่อร่อยค่ะ,pos
ถือว่ามีความคุ้มค่าสมราคาค่ะ,pos
ถือว่ายังไม่มีความคุ้มค่ารึพิเศษอะไรค่ะ.,neg
ถุงเท้าเนื้อผ้าไม่ดี ,neg
ถุงเท้าเนื้อผ้าดีมาก,pos
ถุงเท้าแข็งมากใส่ไม่สบายเลย,neg
ถุงเท้าจริงสั้นกว่ารูปตัวอย่างมาก,neg
ถุงเท้าบางมากก นึกว่าจะหนา ,neg
ถุงขนมไม่มีการเป็นรูหรือฉีกขาด,pos
ถุงที่บรรจุพุทรามาขาด ,neg
ถุงมีรอยปริ ,neg
ถูกใจมากค่ะ ,pos
ถูกใจมากๆๆๆๆอุดหนุนได้เลยร้านนี้ ,pos
ทักแชท แม่ค้าไม่อ่านแชทเลย,neg
ทันใช้พอดีเลยยยยยย ,pos
ทางร้านแพ็คของมาดีมากค่ะ กล่องไม่มีบุบ ,pos
ทางร้านแพคบรรจุมาอย่างดี ราคาก็ถูกกว่าตามห้าง ,pos
ทางร้านแพคสินค้าห่อกันกระแทกมาอย่างดี,pos
